{
  "$schema": "./schema.json",
  "ruleSet": "ios27",
  "dataVersion": "2026.10.15",
  "sdk": "iOS 27.0 SDK (Xcode 27.0, 27A266a)",
  "rules": [
    {
      "id": "SCN001",
      "severity": "error",
      "title": "No scene configuration",
      "summary": "The app declares no scene: its Info.plist has no UIApplicationSceneManifest with a configuration, and its app delegate does not implement application(_:configurationForConnecting:options:). Built with the iOS 27 SDK, it stops at launch with \"UIScene life cycle is required for apps built with this SDK\".",
      "sources": [
        {
          "title": "Apple: Transitioning to the UIKit scene-based life cycle",
          "url": "https://developer.apple.com/documentation/uikit/transitioning-to-the-uikit-scene-based-life-cycle"
        },
        {
          "title": "Apple: application(_:configurationForConnecting:options:)",
          "url": "https://developer.apple.com/documentation/uikit/uiapplicationdelegate/application(_:configurationforconnecting:options:)"
        }
      ]
    },
    {
      "id": "SCN002",
      "severity": "error",
      "title": "Window created in the app delegate",
      "summary": "The app delegate creates the app's window with UIWindow(frame:). Once the app has a scene, UIKit shows only windows that belong to a scene, so this window never appears and the app shows a black screen. Create the window in the scene delegate with UIWindow(windowScene:).",
      "sources": [
        {
          "title": "Apple: Transitioning to the UIKit scene-based life cycle (Configure your window scene)",
          "url": "https://developer.apple.com/documentation/uikit/transitioning-to-the-uikit-scene-based-life-cycle"
        }
      ]
    },
    {
      "id": "SCN003",
      "severity": "warning",
      "title": "App delegate method UIKit no longer calls",
      "summary": "Under the scene life cycle UIKit sends links, user activities, quick actions and foreground and background transitions to the scene delegate, and stops calling the app delegate methods (and launch option keys) that used to receive them, even if they stay implemented.",
      "sources": [
        {
          "title": "Apple: Transitioning to the UIKit scene-based life cycle (Migrate app life-cycle logic)",
          "url": "https://developer.apple.com/documentation/uikit/transitioning-to-the-uikit-scene-based-life-cycle"
        }
      ]
    },
    {
      "id": "SCN004",
      "severity": "warning",
      "title": "Window looked up through the application",
      "summary": "The code finds a window through UIApplication (keyWindow, windows) or the app delegate's window property. With scenes, keyWindow spans every connected scene, windows is deprecated, and UIKit no longer sets the app delegate's window, so it is nil unless the app assigns it and a forced unwrap of it crashes.",
      "sources": [
        {
          "title": "Apple: UIApplication.keyWindow",
          "url": "https://developer.apple.com/documentation/uikit/uiapplication/keywindow"
        },
        {
          "title": "Apple: UIApplication.windows",
          "url": "https://developer.apple.com/documentation/uikit/uiapplication/windows"
        }
      ]
    }
  ],
  "hooks": [
    {
      "id": "open-url",
      "kind": "method",
      "swift": "application(_:open:options:)",
      "objc": "application:openURL:options:",
      "replacement": "scene(_:openURLContexts:), and connectionOptions.urlContexts in scene(_:willConnectTo:options:) for a link that launches the app",
      "swiftUI": ".onOpenURL",
      "sources": [
        {
          "title": "Apple: application(_:open:options:) (deprecated in iOS 26)",
          "url": "https://developer.apple.com/documentation/uikit/uiapplicationdelegate/application(_:open:options:)"
        }
      ]
    },
    {
      "id": "continue-user-activity",
      "kind": "method",
      "swift": "application(_:continue:restorationHandler:)",
      "objc": "application:continueUserActivity:restorationHandler:",
      "replacement": "scene(_:continue:), and connectionOptions.userActivities in scene(_:willConnectTo:options:)",
      "swiftUI": ".onContinueUserActivity",
      "sources": [
        {
          "title": "Apple: application(_:continue:restorationHandler:) (deprecated in iOS 26)",
          "url": "https://developer.apple.com/documentation/uikit/uiapplicationdelegate/application(_:continue:restorationhandler:)"
        }
      ]
    },
    {
      "id": "will-continue-user-activity",
      "kind": "method",
      "swift": "application(_:willContinueUserActivityWithType:)",
      "objc": "application:willContinueUserActivityWithType:",
      "replacement": "scene(_:willContinueUserActivityWithType:)",
      "swiftUI": null,
      "sources": [
        {
          "title": "Apple: application(_:willContinueUserActivityWithType:) (deprecated in iOS 26)",
          "url": "https://developer.apple.com/documentation/uikit/uiapplicationdelegate/application(_:willcontinueuseractivitywithtype:)"
        }
      ]
    },
    {
      "id": "fail-to-continue-user-activity",
      "kind": "method",
      "swift": "application(_:didFailToContinueUserActivityWithType:error:)",
      "objc": "application:didFailToContinueUserActivityWithType:error:",
      "replacement": "scene(_:didFailToContinueUserActivityWithType:error:)",
      "swiftUI": null,
      "sources": [
        {
          "title": "Apple: application(_:didFailToContinueUserActivityWithType:error:) (deprecated in iOS 26)",
          "url": "https://developer.apple.com/documentation/uikit/uiapplicationdelegate/application(_:didfailtocontinueuseractivitywithtype:error:)"
        }
      ]
    },
    {
      "id": "quick-action",
      "kind": "method",
      "swift": "application(_:performActionFor:completionHandler:)",
      "objc": "application:performActionForShortcutItem:completionHandler:",
      "replacement": "windowScene(_:performActionFor:completionHandler:), and connectionOptions.shortcutItem in scene(_:willConnectTo:options:)",
      "swiftUI": null,
      "sources": [
        {
          "title": "Apple: application(_:performActionFor:completionHandler:) (not called for scene-based apps)",
          "url": "https://developer.apple.com/documentation/uikit/uiapplicationdelegate/application(_:performactionfor:completionhandler:)"
        }
      ]
    },
    {
      "id": "did-become-active",
      "kind": "method",
      "swift": "applicationDidBecomeActive(_:)",
      "objc": "applicationDidBecomeActive:",
      "replacement": "sceneDidBecomeActive(_:), or UIApplication.didBecomeActiveNotification for the whole app",
      "swiftUI": "scenePhase",
      "sources": [
        {
          "title": "Apple: applicationDidBecomeActive(_:)",
          "url": "https://developer.apple.com/documentation/uikit/uiapplicationdelegate/applicationdidbecomeactive(_:)"
        }
      ]
    },
    {
      "id": "will-resign-active",
      "kind": "method",
      "swift": "applicationWillResignActive(_:)",
      "objc": "applicationWillResignActive:",
      "replacement": "sceneWillResignActive(_:), or UIApplication.willResignActiveNotification for the whole app",
      "swiftUI": "scenePhase",
      "sources": [
        {
          "title": "Apple: applicationWillResignActive(_:)",
          "url": "https://developer.apple.com/documentation/uikit/uiapplicationdelegate/applicationwillresignactive(_:)"
        }
      ]
    },
    {
      "id": "did-enter-background",
      "kind": "method",
      "swift": "applicationDidEnterBackground(_:)",
      "objc": "applicationDidEnterBackground:",
      "replacement": "sceneDidEnterBackground(_:), or UIApplication.didEnterBackgroundNotification for the whole app",
      "swiftUI": "scenePhase",
      "sources": [
        {
          "title": "Apple: applicationDidEnterBackground(_:)",
          "url": "https://developer.apple.com/documentation/uikit/uiapplicationdelegate/applicationdidenterbackground(_:)"
        }
      ]
    },
    {
      "id": "will-enter-foreground",
      "kind": "method",
      "swift": "applicationWillEnterForeground(_:)",
      "objc": "applicationWillEnterForeground:",
      "replacement": "sceneWillEnterForeground(_:), or UIApplication.willEnterForegroundNotification for the whole app",
      "swiftUI": "scenePhase",
      "sources": [
        {
          "title": "Apple: applicationWillEnterForeground(_:)",
          "url": "https://developer.apple.com/documentation/uikit/uiapplicationdelegate/applicationwillenterforeground(_:)"
        }
      ]
    },
    {
      "id": "launch-url",
      "kind": "launch-option",
      "swift": "launchOptions[.url]",
      "objc": "UIApplicationLaunchOptionsURLKey",
      "replacement": "connectionOptions.urlContexts in scene(_:willConnectTo:options:)",
      "swiftUI": ".onOpenURL",
      "sources": [
        {
          "title": "Apple: UIApplication.LaunchOptionsKey.url (deprecated in iOS 26)",
          "url": "https://developer.apple.com/documentation/uikit/uiapplication/launchoptionskey/url"
        }
      ]
    },
    {
      "id": "launch-user-activity",
      "kind": "launch-option",
      "swift": "launchOptions[.userActivityDictionary]",
      "objc": "UIApplicationLaunchOptionsUserActivityDictionaryKey",
      "replacement": "connectionOptions.userActivities in scene(_:willConnectTo:options:)",
      "swiftUI": ".onContinueUserActivity",
      "sources": [
        {
          "title": "Apple: UIApplication.LaunchOptionsKey.userActivityDictionary (deprecated in iOS 26)",
          "url": "https://developer.apple.com/documentation/uikit/uiapplication/launchoptionskey/useractivitydictionary"
        }
      ]
    },
    {
      "id": "launch-shortcut-item",
      "kind": "launch-option",
      "swift": "launchOptions[.shortcutItem]",
      "objc": "UIApplicationLaunchOptionsShortcutItemKey",
      "replacement": "connectionOptions.shortcutItem in scene(_:willConnectTo:options:)",
      "swiftUI": null,